{
  "$schema": "https://json-schema.org/draft/2020-12/schema",
  "$id": "https://hyperloop.dev/schemas/workflow-event.schema.json",
  "title": "WorkflowEventEnvelope",
  "type": "object",
  "additionalProperties": false,
  "required": [
    "eventId",
    "eventType",
    "occurredAt",
    "workflowId",
    "correlationId",
    "schemaVersion",
    "payload"
  ],
  "properties": {
    "eventId": { "type": "string", "minLength": 1 },
    "eventType": { "type": "string", "minLength": 1 },
    "occurredAt": { "type": "string", "format": "date-time" },
    "workflowId": { "type": "string", "minLength": 1 },
    "correlationId": { "type": "string", "minLength": 1 },
    "schemaVersion": { "type": "string", "const": "1.0.0" },
    "payload": { "type": "object" }
  }
}
